WO Nbr / SR Nbr,raw_Comments
7912102230,call log for machine not coming in service FSC SHRI GIRRAJ-9837634333 call log for machine not in service Engg Kapil 7351522333 [Generated by Portal Login: mohariz1 Contact: Harish 18004199520 customersupport.bti@tsiplc.com] CE IS NOW IN105S02 many more times inform to all entire team direct sunlight has dropped In atm so atm very heatup at site . reload the s/w atm tested ok New Item :2012-2000-8600 New Serial Number :94-55545461 Old Item :2012-2000-8600 Old Serial Number :94-55545461
7912103651,"EnShortage & Overages <enshortages@euronetworldwide.com> cash shortages Rs. 500 (500*1) atm id.SUBN1624 / 29-april-2019 CE IS NOW IN105U03   Analysed EJ logs from last cash loading 18/04/2019 Shortage dated 22/04/2019As per analysis there is no any hardware error found related to cash dispenser,Which may cause reported cash Shortage in ATM. CE WAS IN105U03"
7911703954,"Images required,Date -27/APRIL/2019,Time -12.10-13.30 Bulk Images Required,Date -27, April,2019 Time - 12.10 to 13.30 [Generated by Portal Login: chanburn Contact: Chandan Burnwal 9886455731 chanburn@in.ibm.com] Images required LABOUR. APPROVAL AWAITED image handover to bti team image handover to bti team New Item :2012-2134-8600 New Serial Number :94-52050447 Old Item :2012-2134-8600 Old Serial Number :94-52050447"
7912306480,"machine still not operational atm id TPCN14711 machine still not operational, yesterday Engg: Manoj 7617081737 was working at site for software Updating but still no resolved atm id TPCN14711 [Generated by Portal Login: guptadip Contact: Naresh Bagh 044-49037483 axishelpdesknorth@hitachi-payments.com]as per mail Sandeep.Gupta2@ncr.com CE IS NOW IN105V06 call will be scheduled by 17.00 hrs EM#02: spoke to CE, CE still working onsite, loading software Os upgraded successfully and check it atm is operational kindly align Cit at site for authenticate device New Item :2012-2000-8600 New Serial Number :94-46202753 Old Item :2012-2000-8600 Old Serial Number :94-46202753"
7911604049,"Camera Images required (From external camera & internal camera) TAAN6827 H.N.328, Husainabad Jaunpur-222002 Uttar Pradesh 94-48499802Camera Images required (From external camera & internal camera)/Requester: Recon// Dispute Amount: 4000 //TXN date: 04-04-2019 //TXN TIME: 13.30hr to 14.00hr // TXN no: 856 // Card no: 463237******5110 // ATMO Deependra Singh 8090274120 dksinghsku@gmail.comPlease note that collect the images for complete transaction i.e. from transaction start to transaction end or for complete timing Dont collect the single image for single transaction.If image not found in both camera then kindly share the proper reason for images unavailability along with last images store date and latest sample images to know current camera functionality. [Generated by Portal Login: smitjadh Contact: smita Jadhav 02067350079 tcpslpmnrca@tatacommunications.com] CE IS NOW IN105V06 footage should be provided under chgc cctv images should be copied under chgc copied required images kindly share link to upload it New Item :2012-2000-8600 New Serial Number :94-48499802 Old Item :2012-2000-8600 Old Serial Number :94-48499802"
7911701729,"Switch difference custodian DEEPAK DUVEDI 8176878182amount 2000x4shorage date 26-Apr-19Last EOD 22-Apr-19 [Generated by Portal Login: gohilmon Contact: Dinesh V Mudaliar 02266839133 bob.monitoring@agsindia.com] CE IS NOW IN105W02 CE WAS IN105W02 CE IS NOW IN105W03 we have checked provided ej and found one power interruption during dispense in txn no.5841,need to check with switch New Item :6642-2000-8600 New Serial Number :94-46208451 Old Item :6642-2000-8600 Old Serial Number :94-46208451"
7911607346,switch difference custodian DEEPAK DUVEDI -8176878182amount 500x2 2000x2LAst EOD 16-Apr-19Shortage 20-Apr-19 [Generated by Portal Login: gohilmon Contact: Dinesh V Mudaliar 02266839133 bob.monitoring@agsindia.com] CE IS NOW IN105W03 switch difference   we have checked provided ej and found one power interruption during dispanse in txn no.8445 New Item :6642-2000-8600 New Serial Number :94-46208779 Old Item :6642-2000-8600 Old Serial Number :94-46208779
7912104387,"log for SOFTWARE issue / custAnup 7007645826 tried to call engg but not responding Piysh -8887647871 [Generated by Portal Login: gohilmon Contact: sumit jaiswar 2266839214 bob.agsmonitoring@agsindia.com] CE IS NOW IN105W02 Custodian number not reachable, Please check and revert. EM#09CE travelling to site - ETA 10 mins delete indiavcbackup.log file after that replaced cutter gear and make atm live wdl 1000 time 12:30 New Item :2012-2000-8600 New Serial Number :94-51213401 Old Item :2012-2000-8600 Old Serial Number :94-51213401"
7911702770,Camera Images required (From external camera & internal camera)/Requester: FSG (Police requirement) // Dispute Amount: 15000/- //TXN date: 12th March 2019 //TXN TIME: 15:00pm-19:00pm // TXN no: NA // Card no: NA // ATMO Sandeep Kumar 9451990264 sandeepm021@gmail.comTAAN6909as per mail : SURJA SINGH <contractor> <Surja.Singh@contractor.tatacommunications.com> cctv footages required CE IS NOW IN105W02 visited the site amd collect required footages into pend drive and 2ndry camera tempered from long time more than 2 year. call to Tata local lra Sandeep but continuously phone busy but i will provide to him visited the site amd collect required footages into pend drive and 2ndry camera tempered from long time more than 2 year. call to Tata local lra Sandeep but continuously phone busy but i will provide to him New Item :2012-2000-8600 New Serial Number :94-52684850 Old Item :2012-2000-8600 Old Serial Number :94-52684850
7909111771,"Procedure. – 1.CE to Need to take EJ Backup & need to collect ATM IP Details from Machine before starting the activity. 2. Need to take backup of EJ data.log (Path: C:/programfiles/NCR Aptra/advance NDC/data/EJdata.log) 3. CE Need to take Pre-EJ Docket # from Team Tranxit EJ team-95001508394. Before start loading the SW, CE need read the instruction (Procedure) available in Pen Drive.5. CE need to load the SW by using USB Pen Drive Only, 6. CE need to carry SPS testing tool (device) for checking anti-skimming device. 7. Software Details: Base - IUI 8.05 & Update - IOB 3.01 (SW Release Date 16-Oct-2018)8. Windows firewall should be enabled9. Configure the ATM IP details10. TM Keys will be given by Bank (Need to call concern RCC)11. For ATM download need to call Switch Team on 044-28889387/ 926212. For EJ Docket # CE need to call on below numbers Tranxit EJ team-950015083913. CE need to follow the below Check List Mandatorily, all these check list to be given to us on the same day of installation(1) EJ docket number.(2) Anti-Skimming(SPS) Status(3) IOB-SPS IC format Need to collect from Bank with seal & signatureIf Any Issue & query need to call Mahesh 8050576040 #Software upgradation# # Deployment Activity / Deployment -Centralised approvals /IOB-SPS-Upgradtion Mail received from Maheshkumar, Pukale <Pukale.Maheshkumar@ncr.com> on dated Mon 4/1/2019 5:23 PM *#M-adudit is mandatory *# As per contract. Reload the software.SPS installed New Item :2012-2130-8600 New Serial Number :94-48918478 Old Item :2012-2130-8600 Old Serial Number :94-48918478"
7912103883,Software Issue As per CRA Punit - 9140081809ATM Need to Call log for Software Issue - Same formed to ATM Engineer Ahmed -7080185444 - [Generated by Portal Login: mohariz1 Contact: sandip 18004199520 customersupport.bti@tsiplc.com] CE IS NOW IN105X02 Call schedule for out location resion   Wrong call lodged.ATM working fine New Item :2012-2000-8600 New Serial Number :94-50738290 Old Item :2012-2000-8600 Old Serial Number :94-50738290
7910801604,"This SR is generated for only SPS kit installation and previous SR generated but that time SPS kit not delivered, As confirm from Sachin Agarwal on 5th April 2019 ( Verbal communication )/ Please upload SPS installed images in M-Audit for confimation. #Software upgradation# # Deployment Activity # Deployment - Centralized Approvals # PNB EMV & SPS Confirmation mail received from Ahuja, Sapna <Sapna.Ahuja@ncr.com> on dated Wed 3/6/2135 CE IS NOW IN105X02 As per contract SPS installed successfully New Item :2012-2000-8600 New Serial Number :94-51215039 Old Item :2012-2000-8600 Old Serial Number :94-51215039"
7912008112,dispenser error CUSTODIAN VINOD 7054771726 there is dispenser assemble is damage need to call log for dispenser error same confirm with Engineer Ahmad Khan 7080185444 [Generated by Portal Login: mohariz1 Contact: suchitra 18004199520 customersupport.bti@tsiplc.com] CE IS NOW IN105X02 Call schedule for CRA resion. Remarks - Replace the shutter assembly.ATM working fine. Part recovery nocustomer has kept the faulty part as paid for full module New Item :2012-2000-8600 New Serial Number :94-51944110 Old Item :2012-2000-8600 Old Serial Number :94-51944110
7912102071,"[SPD:SS ATM/ABM:DISPLAY:DISPLAY/TOUCH:TOUCH SCREEN - VANDALIZED:::] MONITOR BLANK ENGINEER sher singh@8006101006 BP 9456594165 [Generated by Portal Login: aashpani Contact: pravin.tripathi 01246264470 sbims-del@hitachi-payments.com] CE IS NOW IN106B13 reconfigure software application, machine working fine.     New Item :5875-0101-7590 New Serial Number :94-36737047 Old Item :5875-0101-7590 Old Serial Number :94-36737047"
7912007294,"Need to call log for cash shortage Need to call log for cash shortage / shortage date 25.04.2019 last eod date 24.04.2019DENO 2000 *2 = TOTAL AMOUNT 4000 / REQUIRED FCR [Generated by Portal Login: phdicici Contact: ICICI PHD 04466367831 icici.phd@hitachi-payments.com] CE IS NOW IN106B13 as per remarks call is sysm. Analysed EJ logs dated 24-Apr-2019 to 25-Apr-2019. There is no hardware error found, related to cash dispenser which may cause reported cash discrepancy. Sum of Transaction amount is matching with the dispensed amount.   Analysed EJ logs dated 24-Apr-2019 to 25-Apr-2019. There is no hardware error found, related to cash dispenser which may cause reported cash discrepancy. Sum of Transaction amount is matching with the dispensed amount.   CE WAS IN106B13"
7910901221,"call log for Theft attempt As per cust Amit 976141232 call log for Theft attempt [Generated by Portal Login: salmhase Contact: Salman Haseeb 9543950505 dfs.phd@hitachi-payments.com] CE IS NOW IN106B16 CE WAS IN106B16 replace shutter assembly, card reader, camera, camera cable, shutter wire, leap door, stay bar, facia latch. Machine is working fine. CE IS NOW IN106B13 New Item :2012-2000-8600 New Serial Number :94-48014511 Old Item :2012-2000-8600 Old Serial Number :94-48014511"
7910401096,"This SR is generated for only SPS kit installation and previous SR generated but that time SPS kit not delivered, As confirm from Sachin Agarwal on 5th April 2019 ( Verbal communication )/ Please upload SPS installed images in M-Audit for confimation. #Software upgradation# # Deployment Activity # Deployment - Centralized Approvals # PNB EMV & SPS Confirmation mail received from Ahuja, Sapna <Sapna.Ahuja@ncr.com> on dated Wed 3/6/2135 CE IS NOW IN106B12 not sps activity done New Item :2012-2000-8600 New Serial Number :94-48918306 Old Item :2012-2000-8600 Old Serial Number :94-48918306"
7912101427,tulsi branch 9760123297 atm id -55782578cit - same atm out of service CE IS NOW IN106B16 call sc Tom reconfigure setting then ok New Item :2012-2000-8600 New Serial Number :94-48919245 Old Item :2012-2000-8600 Old Serial Number :94-48919245
7912003892,"need to call log for cash shortage rs 2000 (2000*1) shortage date need to call log for cash shortage rs 2000 (2000*1) shortage date 02.04.2019 last eod date 30.03.2019 required fcr [Generated by Portal Login: phdicici Contact: ICICI PHD 04466367831 icici.phd@hitachi-payments.com] CE IS NOW IN106B16 as per remarks CE IS NOW IN106B13 Analysed EJ logs dated 30-03-2019 to 02-04-2019 There is no hardware error found, related to cash dispenser which may cause reported cash discrepancy Sum of the withdrawal amount is matching with dispense counter CE WAS IN106B13"
7911701253,machine not coming in service mode branch person Mr. Narender Rawat 8171112898 updated machine not coming in service mode & same informed to engineer Mr. Rakesh 9760069431 [Generated by Portal Login: shelpawa Contact: pankaj kumar 8010105278 suman.kumar@hitachi-payments.com] CE IS NOW IN106U01 CE WAS IN106U01 not replace part and load softwere then ok now working New Item :2012-2000-8600 New Serial Number :94-49255762 Old Item :2012-2000-8600 Old Serial Number :94-49255762
7912007620,ATM Hang- CRA Prashant 8392949267 CE Omprakash 8266000702 ATM Hang- CRA Prashant 8392949267 CE Omprakash 8266000702 [Generated by Portal Login: nafiqure Contact: Asad Khan 9930421633 Asadk@fss.co.in] CE IS NOW IN106U01 CE WAS IN106U01 not at Site a/c not work so machine cover heat and creat issue New Item :2018-2000-8600 New Serial Number :94-56351863 Old Item :2018-2000-8600 Old Serial Number :94-56351863
7912007173,"CALL LOG FOR ATM NOT COMING IN SERVICE SECNH282 [Generated by Portal Login: thasac14 Contact: NEELESH YADAV 02239397115 enicici@euronetworldwide.com] CE IS NOW IN106C15 CE WAS IN106C15 Oracle Order Shipped for Remedy Id: I010880467, Order/Receipt # 305306087, Shipment/Receipt #1022376101, Part has been Shipped, Qty 1, Priority NFO, Shipping Method INDIA SD-Courier-SD, BOL/Job 87199417, Source Location INF INFSDELG loaded software now atm is working fine txn balance inquiry done txn no 6370. New Item :2012-2125-8600 New Serial Number :94-51211564 Old Item :2012-2125-8600 Old Serial Number :94-51211564"
7912100651,Call Log for Software issue Call Log for Software issue // CUST shiv kumar 8384898190 // ENGG SHIV PAL 9651275633 [Generated by Portal Login: tulokesh Contact: Lokesh TU 9380449181 Axis.delhi@hitachi-payments.com] CE IS NOW IN106K01 CE WAS IN106K01 SP# Please help with IP details for this case reloaded the software now atm is working fine balance enquiry is done txn no 4694 time 14:09hrs. dispenser authentication pending plz aling the cra New Item :2012-2000-8600 New Serial Number :94-52684345 Old Item :2012-2000-8600 Old Serial Number :94-52684345
7912307149,"Hood lock was not working-Parmod-7042392957 Hood lock was not working-Parmod-7042392957 [Generated by Portal Login: indushelp1 Contact: Pallab dey 04449037402 indushelpdesh@hitachi-payments.com] CE IS NOW IN106D01 as per CE reset hood lock, lock is working fine.     New Item :2012-2000-8600 New Serial Number :94-48723499 Old Item :2012-2000-8600 Old Serial Number :94-48723499"
7912011061,Incident ID - 000000093365194 GWU-SLM Manual RA=LogField:NCGD1C9M3M | 18Text:30/04/2019 22:28 RP FLM SATYPRAKASH 9599190661 \\ CALL LOG FOR CARD READER ISSUE \\ SLM ENG UDAY 9990363627 \\ RAVI P 7498651 | | CE IS NOW IN106D01 as per CE loaded shofware balance inquiry is done.authicate pending cit end.     New Item :2012-2000-8600 New Serial Number :94-51208118 Old Item :2012-2000-8600 Old Serial Number :94-51208118
7912302044,"Card reader issue P3ENND79Surya Food & Agro LtdSurya Food & Agro Ltd,A-1, Udyog Vihar (Opp D.M. Office) Greater Noida 201306 U.P. [Generated by Portal Login: thasac14 Contact: Mangesh 022-39397152 enhdfc1@euronetworldwide.com] CE IS NOW IN106D01 SP# This is to inform you that, FLM not done at site & call is logged by custodian without remote support from CE. Please deploy FLM first & confirm us to cancel this call.   Card reader clear ATM is fine balance inquiry is done. New Item :2012-2000-8600 New Serial Number :94-56528804 Old Item :2012-2000-8600 Old Serial Number :94-56528804"
7912003597,Card Reader Issue As Per Cust Shubham Jain - 8630319875; Eng Mr.Sumit 9927933280 Card Reader Issue As Per Cust Shubham Jain - 8630319875; Eng Mr.Sumit 9927933280Eng Not Responding the Call [Generated by Portal Login: guptadip Contact: Kartik M 9380449162 kartik.ma@hitachi-payments.com] CE IS NOW IN136B04 CE WAS IN136B04 full cost approval received. CE IS NOW IN106E04 New Item :2012-2000-8600 New Serial Number :94-48496875 Old Item :2012-2000-8600 Old Serial Number :94-48496875
7911306626,Caller Name/No: Sibli Kumari 8130693738Custodian Name/No:Sibli Kumari 8210185850ATM ID:21594459Email ID:Required CCTV Footages Date/Time:14/3/2019 15:48 and 16:51- 16:57AND 25/3/2019 19:39 and 15:34 Required CCTV Footages CE IS NOW IN106K01 Remark. Footages handover to branch person Mr. Sibli Kumar atm tested ok working fine. CE IS NOW IN106G81 New Item :2012-2000-8600 New Serial Number :94-48920555 Old Item :2012-2000-8600 Old Serial Number :94-48920555
7911906474,CALL LOG FOR CARD READER ISSUE SECNF566 [Generated by Portal Login: thasac14 Contact: NEELESH YADAV 02239397150 enicici@euronetworldwide.com] CE IS NOW IN106K01 CE WAS IN106K01 Replace main amps power supply and dispenser controller board done atm tested ok working fine Replace main amps power supply and dispenser controller board done atm tested ok working fine New Item :2012-2125-8600 New Serial Number :94-49254045 Old Item :2012-2125-8600 Old Serial Number :94-49254045
7912104391,"ATM Machine not coming in service SLM call log for ATM Machine not coming in service Custodian RAJIV 9599978094 , Engineer Mohit [Generated by Portal Login: guptadip Contact: Kartik M 9380449162 kartik.ma@hitachi-payments.com] CE IS NOW IN106H02 CRA schedule is required to visit site during night time.   adjust the vga cable. activity not working New Item :2012-2000-8600 New Serial Number :94-45193125 Old Item :2012-2000-8600 Old Serial Number :94-45193125"
7912103262,Incident ID - 000000093373392 GWU-SLM- Card Reader-Call logged w RA=LogField:NCGD1262PP | 27Text:01/05/2019 16:21 KB Call Log For Card reader .Engineer - Mr.Ajay// 8882688767 Custodian Ravi // 9555111558 . | | CE IS NOW IN106H01 12.00 as per my eta SP# CE Ajay would attend the site till 12.00Hrs loaded the software atm working fine New Item :2012-2000-8600 New Serial Number :94-50739336 Old Item :2012-2000-8600 Old Serial Number :94-50739336
7912008580,Need call log for ATM machine not coming in service as per cra vikash 8700952047 //Need call log for ATM machine not coming in service//same confirm with atmo pradeep kumar 8447954586 [Generated by Portal Login: ganebark Contact: Ganesh Barkade 020 - 6735014 ganesh.barkade@tatacommunications.com] CE IS NOW IN106K01 CE WAS IN106K01 EM#02: CE working on site issue resolved. adjust the data cable New Item :2012-2000-8600 New Serial Number :94-52055032 Old Item :2012-2000-8600 Old Serial Number :94-52055032
7912100922,Monitor blank issue Monitor blank issue [Generated by Portal Login: thasac14 Contact: shekhar 02239397103 enhdfc1@euronetworldwide.com] CE IS NOW IN106H02 mother required. and ram . approval taken anil sir g replaced the mother board and ram . but ac not working at site New Item :2012-2000-8600 New Serial Number :94-54065191 Old Item :2012-2000-8600 Old Serial Number :94-54065191
7910808798,Anil Kumar 9675999902 Cassette Calibration of new 100 denomination notes Anil Kumar 9675999902 Cassette Calibration of new 100 denomination notes [Generated by Portal Login: nafiqure Contact: Asad Khan 9930421633 Asadk@fss.co.in] CE IS NOW IN106J02 cassette need to be calibration on chgc basis cassettes calibration done atm is working fine cassettes calibration done atm is working fine New Item :2012-2000-8600 New Serial Number :94-45190243 Old Item :2012-2000-8600 Old Serial Number :94-45190243
7910808776,Anil Kumar 9675999902 Cassette Calibration of new 100 denomination notes Anil Kumar 9675999902 Cassette Calibration of new 100 denomination notes [Generated by Portal Login: nafiqure Contact: Asad Khan 9930421633 Asadk@fss.co.in] CE IS NOW IN106J02 cassette need to be calibration on chgc basis cassettes calibration done atm is working fine cassettes calibration done atm is working fine New Item :2012-2000-8600 New Serial Number :94-45190264 Old Item :2012-2000-8600 Old Serial Number :94-45190264
7909404602,"# Deployment Activity # Deployment - Centralized Approval # Hitachi Axis SPS and RAM Upgradation SPS Kit to be upgraded, RAM to be installed , Counter Print must be taken , same need to be Updated On M-Audit , EJ Backup to be taken and Confirmation to be taken from Euronet, Post EJ Docket Number to be Collected , Solidcore Docket Number to Be collected , ICs to be Collected ,SPS kit needs to be installed as per the process shared by TSS and screens needs to be captured in M Audit app, before leaving the site engineer has to perform a transaction using chip card and successful transaction screen to be captured in M Audit app as per the tech bulletin released by TSS. # Deployment Activity # Deployment - Centralized Approval # Hitachi Axis SPS and OS Upgradation CE IS NOW IN106J02 install SPS machine working fine install SPS machine working fine New Item :2012-2000-8600 New Serial Number :94-48137804 Old Item :2012-2000-8600 Old Serial Number :94-48137804"
7910002754,"# Deployment Activity # Deployment - Centralized Approval # Hitachi Axis SPS Upgradation SPS Kit to be upgraded, EMV, to be installed. Hitachi Axis IUI 8.05 Update Ver 3.08 to be loaded , Counter Print must be taken , same need to be Updated On M-Audit , EJ Backup to be taken and Confirmation to be taken from Euronet, Post EJ Docket Number to be Collected , Solidcore Docket Number to Be collected , ICs to be Collected ,SPS kit needs to be installed as per the process shared by TSS and screens needs to be captured in M Audit app, before leaving the site engineer has to perform a transaction using chip card and successful transaction screen to be captured in M Audit app as per the tech bulletin released by TSS. # Deployment Activity # Deployment - Centralized Approval # Hitachi Axis SPS Upgradation CE IS NOW IN106J02 install SPS machine working fine install SPS machine working fine New Item :2012-2000-8600 New Serial Number :94-48138655 Old Item :2012-2000-8600 Old Serial Number :94-48138655"
7912006272,"Caller Anil from NCR 9837092334CIT: same ATM Down CE IS NOW IN106J02 Oracle Order Shipped for Remedy Id: I010878762, Order/Receipt # 305304288, Shipment/Receipt #1022346565, Part has been Shipped, Qty 1, Priority NFO, Shipping Method INDIA SD-Courier-SD, BOL/Job 87157995, Source Location INF INFSDELG Replace heat sink machine has been operational done New Item :2012-2000-8600 New Serial Number :94-48141414 Old Item :2012-2000-8600 Old Serial Number :94-48141414"
7910808791,Anil Kumar 9675999902 Cassette Calibration of new 100 denomination notes Anil Kumar 9675999902 Cassette Calibration of new 100 denomination notes [Generated by Portal Login: nafiqure Contact: Asad Khan 9930421633 Asadk@fss.co.in] CE IS NOW IN106J02 cassette need to be calibration on chgc basis cassettes calibration done atm is working fine cassettes calibration done atm is working fine fine New Item :2018-2000-8600 New Serial Number :94-56351994 Old Item :2018-2000-8600 Old Serial Number :94-56351994
7912206845,"Date and year configure wrong Date and year configure wrong [Generated by Portal Login: mohariz1 Contact: vishal s 9762671122 vishal.sawalakh@tsiplc.com] CE IS NOW IN106M06 Escalation Request: Please provide new ETA and expedite for service. [Added by: GCC NCR Category : ETA Related Issue Phone Number: 8002627782 Email Address: ncr.com Contact By: Email Currently not able to reach CE, will confirm the ETA shortly. configure the date and time .atm working fine New Item :2012-2000-8600 New Serial Number :94-51207749 Old Item :2012-2000-8600 Old Serial Number :94-51207749"
7912208483,monitor blank issue As per Cra Vinay 09760103399 //Need to call log for monitor blank issue// Same confirm with Engg. Lavi gupta 8439333936 [Generated by Portal Login: ganebark Contact: Ganesh Barkade 020 - 6735014 ganesh.barkade@tatacommunications.com] CE IS NOW IN106J02 CE WAS IN106J02 I reached site then loaded full sw on site and here modem issue on site already informed to tata person Kirton. I reached site then loaded full sw on site and here modem issue on site already informed to tata person Kirton. New Item :2012-2000-8600 New Serial Number :94-50737838 Old Item :2012-2000-8600 Old Serial Number :94-50737838
7910401025,"This SR is generated for only SPS kit installation and previous SR generated but that time SPS kit not delivered, As confirm from Sachin Agarwal on 5th April 2019 ( Verbal communication )/ Please upload SPS installed images in M-Audit for confimation. #Software upgradation# # Deployment Activity # Deployment - Centralized Approvals # PNB EMV & SPS Confirmation mail received from Ahuja, Sapna <Sapna.Ahuja@ncr.com> on dated Wed 3/6/2135 CE IS NOW IN106R03 SPS kit Installed Successfully done and check properly atm tested ok working fine. SPS kit Installed Successfully done and check properly atm tested ok working fine. New Item :2012-2000-8600 New Serial Number :94-48725337 Old Item :2012-2000-8600 Old Serial Number :94-48725337"
7910801841,"This SR is generated for only SPS kit installation and previous SR generated but that time SPS kit not delivered, As confirm from Sachin Agarwal on 5th April 2019 ( Verbal communication )/ Please upload SPS installed images in M-Audit for confimation. #Software upgradation# # Deployment Activity # Deployment - Centralized Approvals # PNB EMV & SPS Confirmation mail received from Ahuja, Sapna <Sapna.Ahuja@ncr.com> on dated Wed 3/6/2135 CE IS NOW IN106R03 SPS kit Installed Successfully done and check properly atm tested ok working fine . SPS kit Installed Successfully done and check properly atm tested ok working fine . New Item :2012-2000-8600 New Serial Number :94-52046273 Old Item :2012-2000-8600 Old Serial Number :94-52046273"
7912203398,Incident ID - 000000093383847 GWU-SLM- Card Reader-Call logged w RA=LogField:NCGD126S3J | 27 CE IS NOW IN106R02 CE WAS IN106R02 CE IS NOW IN106R03 Ce Take Remote Support to CRA issue Resolved atm Operational working fine. New Item :2012-2000-8600 New Serial Number :94-52699810 Old Item :2012-2000-8600 Old Serial Number :94-52699810
