WO Nbr / SR Nbr,raw_Comments
7909313925,"BOB EMV to be upgraded with ASD kit installation, Combined_BOB_Update_IUI_8.05_Ver_ 1.0/ All procedure same like BOB EMV Activity, Additional Screen need to load which is provided in the mail/ IC is mandatory for ASD Kit and Procedure also available in the mail. #Software upgradation# # Deployment Activity / Deployment -Centralised approvals/ EMV Rollout for BOB/Confirmation received from Imran on Wed 4/3/2019 4:59 PM CE IS NOW IN104P82 Pre EJ docket no-FSSMUM2604191455054Post EJ docket no-FSSMUM2604191933104 OS upgradation + SPS KIT INSTALLATION Pre EJ docket no-FSSMUM2604191455054Post EJ docket no-FSSMUM2604191933104 New Item :2012-2000-8600 New Serial Number :94-48719418 Old Item :2012-2000-8600 Old Serial Number :94-48719418"
7909313176,"BOB EMV to be upgraded with ASD kit installation, Combined_BOB_Update_IUI_8.05_Ver_ 1.0/ All procedure same like BOB EMV Activity, Additional Screen need to load which is provided in the mail/ IC is mandatory for ASD Kit and Procedure also available in the mail. #Software upgradation# # Deployment Activity / Deployment -Centralised approvals/ EMV Rollout for BOB/Confirmation received from Imran on Wed 4/3/2019 4:59 PM CE IS NOW IN104Q06 Remarks:- OS upgradation + SPS KIT INSTALLATION Pre EJ docket no-FSSMUM2704191132013Post EJ docket no-FSSMUM2704191455045 Remarks:- OS upgradation + SPS KIT INSTALLATION Pre EJ docket no-FSSMUM2704191132013 Post EJ docket no-FSSMUM2704191455045Resolution DescriptionPublishDelete New Item :2012-2000-8600 New Serial Number :94-48719419 Old Item :2012-2000-8600 Old Serial Number :94-48719419"
7912007167,"# EJ - EJ FSS Agent 6.2.1 need to be loaded atm id 1FNRCH09contact : 2266020410as pe rmail : Mikhil Pawar <mikhilp@fss.co.in> # EJ - EJ FSS Agent 6.2.1 need to be loaded CE IS NOW IN104A04 RC: NCR Delay, Field Availability Post EJ docket - FSSMUM0205191838072 New Item :2012-2000-8600 New Serial Number :94-48719727 Old Item :2012-2000-8600 Old Serial Number :94-48719727"
7909314917,"BOB EMV to be upgraded with ASD kit installation, Combined_BOB_Update_IUI_8.05_Ver_ 1.0/ All procedure same like BOB EMV Activity, Additional Screen need to load which is provided in the mail/ IC is mandatory for ASD Kit and Procedure also available in the mail. #Software upgradation# # Deployment Activity / Deployment -Centralised approvals/ EMV Rollout for BOB/Confirmation received from Imran on Wed 4/3/2019 4:59 PM CE IS NOW IN104Q06 OS upgradation + SPS KIT INSTALLATION Pre EJ docket no-FSSMUM2904190927002Post EJ docket no-FSSMUM2904191822067 OS upgradation + SPS KIT INSTALLATION Pre EJ docket no-FSSMUM2904190927002Post EJ docket no-FSSMUM2904191822067 New Item :2012-2000-8600 New Serial Number :94-48719730 Old Item :2012-2000-8600 Old Serial Number :94-48719730"
7909316433,"BOB EMV to be upgraded with ASD kit installation, Combined_BOB_Update_IUI_8.05_Ver_ 1.0/ All procedure same like BOB EMV Activity, Additional Screen need to load which is provided in the mail/ IC is mandatory for ASD Kit and Procedure also available in the mail. #Software upgradation# # Deployment Activity / Deployment -Centralised approvals/ EMV Rollout for BOB/Confirmation received from Imran on Wed 4/3/2019 4:59 PM CE IS NOW IN104Q06 :- OS upgradation + SPS KIT INSTALLATION Pre EJ docket no-FSSMUM2704191700063Post EJ docket no-FSSMUM2804191526007 :- OS upgradation + SPS KIT INSTALLATION Pre EJ docket no-FSSMUM2704191700063Post EJ docket no-FSSMUM2804191526007 New Item :2012-2000-8600 New Serial Number :94-50738334 Old Item :2012-2000-8600 Old Serial Number :94-50738334"
7911004833,"Software Security Solution Installation Base IUI 8.05 & FIS BOI update // CE to follow Procedure1. CE to take counter Slip 2. Engg need to call Security application EJ team to pull the EJ’s available in ATM before activitystart (Not applicable for New Installation)EJ Team Number: 080 -46593748/49.4) Before starting the activity CE to login in Admin mode & perform the Telnet for below IP’s & port #Ø 172. 21.214.220 443 (Solidcore)Ø 172. 21.214.222 7300 (HDE Server)Ø 172. 21.214.223 7300 (HDE Server)Note: Post Successful telnet only CE need to start the activity5) Format the Hard disk both (Primary & Secondary)6) Base IUI 8.05 & FIS BOI update7) Once Base is completed CE need to configure the ATM IP details & need to check the telnet forBelow IP’s & Port #8) Telnet to be checkØ 172. 21.214.220 443 (Solidcore)Ø 172. 21.214.222 7300 (HDE Server)Ø 172. 21.214.223 7300 (HDE Server)9) Basis on the successful telnet, Engg can start the update10) Engg need to ask for BIOS password. During this process, Engineer will be asked with followingdetails ATM Serial No, Engg Name, Contact Details, Work Order No etc.FIS team Contact details: - for Solid core and BIOS password080-46593748/4911) Once Update is completed Need to configure the BIOS Password (Mandatory)12) Once installations are successful, Engineer need to call EJ team for Post Docket number. (080-46593747)13) Once EJ docket number received, Engg need to call to Security team along with EJ docketnumber for getting the Solidcore. (080-46593748/49)14) Security team will check and confirm below details before sharing Docket no to Engg· ATM Status· Solidcore parameters on ePO/URL· HDE Status· Txn no (Normal / VG)· Engg need to change BIOS password (Recommended for first time Solidcore /HDE installation only).15) Security team will provide Solidcore Docket No on further successful verification of all requiredparameters.16) HDE Docket number will be shared with NCR team aft #Software upgradation# # Deployment Activity / Deployment -Centralised approvals / FIS BOIDeployment - Centralized Approvals CE IS NOW IN904L - FIPL Software upgradation Software upgradation New Item :2012-2000-8600 New Serial Number :94-54063188 Old Item :2012-2000-8600 Old Serial Number :94-54063188"
7911203317,"""#Software upgradation# # Deployment Activity / Deployment -Centralised approvals / FIS BOI Archana.SHINDE@ncr.com Software Security Solution Installation Base IUI 8.05 & FIS BOI update // CE to follow Procedure 1. CE to take counter Slip 2. Engg need to call Security application EJ team to pull the EJÃ¢â‚¬â„¢s available in ATM before activity start (Not applicable for New Installation) EJ Team Number: 080 -46593748/49. 4) Before starting the activity CE to login in Admin mode & perform the Telnet for below IPÃ¢â‚¬â„¢s & port # ÃƒËœ 172. 21.214.220 443 (Solidcore) ÃƒËœ 172. 21.214.222 7300 (HDE Server) ÃƒËœ 172. 21.214.223 7300 (HDE Server) Note: Post Successful telnet only CE need to start the activity 5) Format the Hard disk both (Primary & Secondary) 6) Base IUI 8.05 & FIS BOI update 7) Once Base is completed CE need to configure the ATM IP details & need to check the telnet for Below IPÃ¢â‚¬â„¢s & Port # 8) Telnet to be check ÃƒËœ 172. 21.214.220 443 (Solidcore) ÃƒËœ 172. 21.214.222 7300 (HDE Server) ÃƒËœ 172. 21.214.223 7300 (HDE Server) 9) Basis on the successful telnet Engg can start the update 10) Engg need to ask for BIOS password. During this process Engineer will be asked with following details ATM Serial No Engg Name Contact Details Work Order No etc. FIS team Contact details: - for Solid core and BIOS password 080-46593748/49 11) Once Update is completed Need to configure the BIOS Password (Mandatory) 12) Once installations are successful Engineer need to call EJ team for Post Docket number. (080- 46593747) 13) Once EJ docket number received Engg need to call to Security team along with EJ docket number for getting the Solidcore. (080-46593748/49) 14) Security team will check and confirm below details before sharing Docket no to Engg Ã‚Â· ATM Status Ã‚Â· Solidcore parameters on ePO/URL Ã‚Â· HDE Status Ã‚Â· Txn no (Normal / VG) Ã‚Â· Engg need to change BIOS password (Recommended for first time Solidcore / HDE installation only). 15) Security team will provide Solidcore Docket No o CE IS NOW IN104Q06 Software upgradation Atm id-CRA9003Post EJ docket - BOI010519065SOLODCORE docket-BOISOL010519005 Software upgradation Atm id-CRA9003Post EJ docket - BOI010519065SOLODCORE docket-BOISOL010519005 New Item :2012-2000-8600 New Serial Number :94-54064090 Old Item :2012-2000-8600 Old Serial Number :94-54064090"
7909207673,atm not coming in service [Generated by Portal Login: shirmala Contact: Shireesh Malandkar 02266839157 dop.monitoring@agsindia.com] CE IS NOW IN105W03 CE WAS IN105W03 visited the site and reload the software and tested ok working fine visited the site and reload the software and tested ok working fine New Item :2012-2000-8600 New Serial Number :94-51943327 Old Item :2012-2000-8600 Old Serial Number :94-51943327
7911607073,"Dear Team Kindly Log the SLM Call for the below Mentioned Images Retrieval Case **Internal / External Camera & share Docket IDPlz ensure TXN details should be captured in mention time frame, Card Details mention for Exact Images of TXN'sATM ID2405WS17Site ID NUPLUC102Address Location City Sarojini NagarOpp.Ajanta PlazaHydil Gate, Sarojini Nagar, Lucknow , U.P. 226008TypeMetroLucknowUttar PradeshSR no94-52046807FSO Virendra 7705023215TXN Dt.Trx. TimeTXN No Amount27-02-201915.55-16.10905816005810/9058160058796500Card5381032206003858* NORTHAs per Mail from Cctv Services <cctv.services@writercorporation.com> Internal / External Footages Retreival CE IS NOW IN105A25 Visited the site and copy the required images and tested ok. Visited the site and copy the required images and tested ok. New Item :2012-2000-8600 New Serial Number :94-52046807 Old Item :2012-2000-8600 Old Serial Number :94-52046807"
7911604208,"#camera activity call #camera activity call (images required)need cam1 cam2 footages require, on priority. date-15-03-2019time-14:15 to14:30 Txn no- NATxn Amt- NANote:-Slot will be created for uploading images( Kindly provide Eng. contact details & mail id ) [Generated by Portal Login: singhaut Contact: Farzeen Kazi T :022-33865300  extn:22284 PSSBAU_DVR@fisglobal.com] CE IS NOW IN105B23 CE WAS IN105B23 Visited the site and copy the required images and tested ok. Remark- External camera cable damaged that's why cam2 not working. Visited the site and copy the required images and tested ok. Remark- External camera cable damaged that's why cam2 not working. New Item :2012-2000-8600 New Serial Number :94-52682572 Old Item :2012-2000-8600 Old Serial Number :94-52682572"
7911004697,"Software Security Solution Installation Base IUI 8.05 & FIS BOI update // CE to follow Procedure1. CE to take counter Slip 2. Engg need to call Security application EJ team to pull the EJ’s available in ATM before activitystart (Not applicable for New Installation)EJ Team Number: 080 -46593748/49.4) Before starting the activity CE to login in Admin mode & perform the Telnet for below IP’s & port #Ø 172. 21.214.220 443 (Solidcore)Ø 172. 21.214.222 7300 (HDE Server)Ø 172. 21.214.223 7300 (HDE Server)Note: Post Successful telnet only CE need to start the activity5) Format the Hard disk both (Primary & Secondary)6) Base IUI 8.05 & FIS BOI update7) Once Base is completed CE need to configure the ATM IP details & need to check the telnet forBelow IP’s & Port #8) Telnet to be checkØ 172. 21.214.220 443 (Solidcore)Ø 172. 21.214.222 7300 (HDE Server)Ø 172. 21.214.223 7300 (HDE Server)9) Basis on the successful telnet, Engg can start the update10) Engg need to ask for BIOS password. During this process, Engineer will be asked with followingdetails ATM Serial No, Engg Name, Contact Details, Work Order No etc.FIS team Contact details: - for Solid core and BIOS password080-46593748/4911) Once Update is completed Need to configure the BIOS Password (Mandatory)12) Once installations are successful, Engineer need to call EJ team for Post Docket number. (080-46593747)13) Once EJ docket number received, Engg need to call to Security team along with EJ docketnumber for getting the Solidcore. (080-46593748/49)14) Security team will check and confirm below details before sharing Docket no to Engg· ATM Status· Solidcore parameters on ePO/URL· HDE Status· Txn no (Normal / VG)· Engg need to change BIOS password (Recommended for first time Solidcore /HDE installation only).15) Security team will provide Solidcore Docket No on further successful verification of all requiredparameters.16) HDE Docket number will be shared with NCR team aft #Software upgradation# # Deployment Activity / Deployment -Centralised approvals / FIS BOIDeployment - Centralized Approvals CE IS NOW IN105A08 security software need to be load. security software base 8.05 and update 4.06 loaded successfully tasted ok working fine. New Item :2012-2000-8600 New Serial Number :94-54064063 Old Item :2012-2000-8600 Old Serial Number :94-54064063"
7911202043,". ""#Software upgradation# # Deployment Activity / Deployment -Centralised approvals / FIS BOI Archana.SHINDE@ncr.com CE IS NOW IN105A24 visited the site and done the activity successful visited the site and done the activity successful New Item :2012-2000-8600 New Serial Number :94-54065016 Old Item :2012-2000-8600 Old Serial Number :94-54065016"
7911507860,"Pawar, Manoj <Manoj.Pawar@ncr.com> Thu 4/25/2019 7:55 PM CCTV footages required for Transaction date: 18-04-2019, Transation time: 08:39:20, Trxn number: 6075, Transaction amount: 7500 CE IS NOW IN105B23 chgi ce visited at site and copied the required Images successfully atm tested ok New Item :6642-2000-8600 New Serial Number :94-45501125 Old Item :6642-2000-8600 Old Serial Number :94-45501125"
7911607477,"Switch difference amount 500x3shortage date 20-Apr-19Last EOD 10-Apr-19 [Generated by Portal Login: gohilmon Contact: Dinesh V Mudaliar 02266839133 bob.monitoring@agsindia.com] Switch difference CE IS NOW IN105B23   Checked Ej logs provided by AGS team found power Interruption during dispense in Txn no 5609 and 5909, so need to check these transaction status at switch end New Item :6642-2000-8600 New Serial Number :94-46208340 Old Item :6642-2000-8600 Old Serial Number :94-46208340"
7907900231,"Hitachi OS Migration from Windows XP To Windows 7 , Hitachi Update IUI 8.05 Update ver 3.08 To be Loaded , EJ to be Pulled By calling HPY EJ HD on 04449037416 , Post Installation Updatelog.txt to be checked and updated on M-AUDIT , EJ Docket No. post installation to be collected and Solidcore Docket Number to be Collected from 022 62175725 . EJ And Solidcore Docket No. is Mandatory #Software Upgradation# Deployment Activity / Deployment -Centralised approval #Hitachi OS Migration CE IS NOW IN105B81 Hitachi win-7 IUI-8.05 & update-3.08 loaded successfully tested ok working fine.. Hitachi win-7 IUI-8.05 & update-3.08 loaded successfully tested ok working fine.. New Item :2012-2000-8600 New Serial Number :94-46868111 Old Item :2012-2000-8600 Old Serial Number :94-46868111"
7908606007,"# Deployment Activity # Deployment - Centralized Approval # Hitachi Axis SPS Upgradation SPS Kit to be upgraded, EMV, to be installed. Hitachi Axis IUI 8.05 Update Ver 3.08 to be loaded , Counter Print must be taken , same need to be Updated On M-Audit , EJ Backup to be taken and Confirmation to be taken from Euronet, Post EJ Docket Number to be Collected , Solidcore Docket Number to Be collected , ICs to be Collected ,SPS kit needs to be installed as per the process shared by TSS and screens needs to be captured in M Audit app, before leaving the site engineer has to perform a transaction using chip card and successful transaction screen to be captured in M Audit app as per the tech bulletin released by TSS # Deployment Activity # Deployment - Centralized Approval # Hitachi Axis SPS Upgradation CE IS NOW IN105B81 Hitachi win-7 IUI-8.05 & update-3.08+ SPS + 4GB RAM & loaded successfully tested ok working fine.. Hitachi win-7 IUI-8.05 & update-3.08+ SPS + 4GB RAM & loaded successfully tested ok working fine.. New Item :2012-2000-8600 New Serial Number :94-46868111 Old Item :2012-2000-8600 Old Serial Number :94-46868111"
7907900225,"Hitachi OS Migration from Windows XP To Windows 7 , Hitachi Update IUI 8.05 Update ver 3.08 To be Loaded , EJ to be Pulled By calling HPY EJ HD on 04449037416 , Post Installation Updatelog.txt to be checked and updated on M-AUDIT , EJ Docket No. post installation to be collected and Solidcore Docket Number to be Collected from 022 62175725 . EJ And Solidcore Docket No. is Mandatory #Software Upgradation# Deployment Activity / Deployment -Centralised approval #Hitachi OS Migration CE IS NOW IN105B81 Hitachi win-7 IUI-8.05 & update-3.08 loaded successfully tested ok working fine.. Hitachi win-7 IUI-8.05 & update-3.08 loaded successfully tested ok working fine.. New Item :2012-2000-8600 New Serial Number :94-46868113 Old Item :2012-2000-8600 Old Serial Number :94-46868113"
7912103659,"EnShortage & Overages <enshortages@euronetworldwide.com> cash shortages Rs.5500/- (500*11) atm id. ABNRJ027 / 25-april-2019 CE IS NOW IN105B27   Analysed EJ logs from last cash loading 18/04/2019 Shortage dated 22/04/2019As per analysis there is no any hardware error found related to cash dispenser,Which may cause reported cash Shortage in ATM. CE WAS IN105B27"
7912208970,"machine is not coming in service 1246, Mathura Nagar, Ganga Ganj, Panki, Kanpur, Uttar Pardesh. 208020. [Generated by Portal Login: thasac14 Contact: pritesh kadam 02239397354 ENAXIS@euronetworldwide.com] CE IS NOW IN105B23 call will attend tomorrow 1030hrs due to security reasons CE IS NOW IN105B15 Now backroom acces is available and restart v sat and atm is live. But dispenser error is at site kindly arrange cit at site to clear  dispenser . New Item :2012-2000-8600 New Serial Number :94-48140190 Old Item :2012-2000-8600 Old Serial Number :94-48140190"
7911507131,"shortage need to be call log for shortage in the deno 500*5 CRA RAHUL SINGH 9136644064 LAST EOD DATE 23.04.2019 SHORTAGE DATE 25/04/2019address : BOI ,VILL & POST BANAGARMAU UNNAO 209821 [Generated by Portal Login: singhaut Contact: Divya solanki 02233865300 fipss_slm@fisglobal.com] Cash shortage CE IS NOW IN105B23 Mail sent to MS for EJ logs checked Ej logs provided by AGS team no any hardware or software error found that may cause any cash shortage so need to match cash physical and switch New Item :6642-2000-8600 New Serial Number :94-48505932 Old Item :6642-2000-8600 Old Serial Number :94-48505932"
7912104229,"software issue not resolved atm id BPCN85417 software issue not resolved, engineer was working at site atm id BPCN85417Engg: Anand 7500859125 [Generated by Portal Login: guptadip Contact: Naresh Bagh 044-49037483 axishelpdesknorth@hitachi-payments.com] CE IS NOW IN105B81 visited the site reloaded the full software and sps installation successfully and 4GB ram install and machine operational transaction done     New Item :2012-2000-8600 New Serial Number :94-48723163 Old Item :2012-2000-8600 Old Serial Number :94-48723163"
7912208321,"Camera not working. Camera not working. we have received the image dispute from abnk. txn date-26th Apr, TXN no-0465, TXN amt-4500. pls align the CE and confirm why camera not working at site. [Generated by Portal Login: mohariz1 Contact: Mohammed Rizwan 7022730777 dnyaneshwar.amale@mphasis.com] CE IS NOW IN105B15 atm is operational so call type is chgi site will be attend tomorrow at 16:00hrs chgi visited site and found that required images on date 26 April 19 is not available . we have check ej logs and images and found that power failure on date 24 /april 19 at 00:10 and last image capture on same time after that camera getting stop and not capture required images currently camera is working fine. New Item :2012-2000-8600 New Serial Number :94-50891941 Old Item :2012-2000-8600 Old Serial Number :94-50891941"
7911908220,"# EJ – EJ NCR EJ to be loaded. FSC – CENTRALIZED APPROVALSToll free no :- 18002095658 option 1Mail From: Mankare, Suraj Damodar Sent: Monday, April 29, 2019 7:20 PM # EJ – EJ NCR EJ to be loaded. FSC – CENTRALIZED APPROVALS CE IS NOW IN105B27 chgc As there UPS issue at site , call is also logged for the same so dkt no couldn't be collected till the UPS issue is resolved hence call is closed now New Item :2012-2000-8600 New Serial Number :94-51150469 Old Item :2012-2000-8600 Old Serial Number :94-51150469"
7911308042,"CCTV footage required TERM BANKATM IDCARD NO.ACCOUNT NO.RR NO.TR. DATETR. TIMED/CTR. AMTTR. TYPESBIS10A000201019607431XXXXXX625410655072443888707/01/201918:53:30D10000WDLATM IDS10A000201019ADDRESS NRI BRANCH MAHMOORGANJPROBLEMUNAUHTRISED TRANSACTIONCUSTODIAN'S NAMESBI ATM DEPTT., LHO LUCKNOWCUSTODIAN FROM BRANCH OR AGENCYNACUSTODIAN NUMBER9794865062, 9839108408TO whom should the CCTV Footage handed overagmatm.lholuc@sbi.co.in, atmcomplaints.lholuc@sbi.co.in OR Dispatch CD/PD to:The Asstt. General Manager (ATM Ops.)State Bank of IndiaLocal Head Office,3rd Floor, B wingM.G. Marg, Lucknow-226001Karki, Prakash <Prakash.Karki@ncr.com> CCTV footage required LABOUR. APPROVAL AWAITED visited at site check and found required footage not available due to required footage 3month old same inform to cm so call close *ntb* New Item :5362-7701-8690 New Serial Number :94-43355104 Old Item :5362-7701-8690 Old Serial Number :94-43355104 *NTB*"
7909603428,"[SPD:SS ATM/ABM:ATM ENCLOSURE:SS ENCLOSURE:ATM CABINET DOOR DAMAGED:::] CCTV FOOTAGE REQUIREDATM IDDATE OF TRNXTXN NumberTXN AMTDispute ATMNODAL BRANCHERRORCRAMAKARCIRCLES1BB00020111709-Aug-1864592000016000VARANASI*6459*2*E(1*300004000000000,M-18,R-10010000CMSNCRLUCKNOWCM Ramesh Kumar/Bipin Rai-9415304818 / 9140417207 [Generated by Portal Login: mathrema Contact: Rahul 022-21583830 sbinorthwest@fss.co.in] CCTV FOOTAGE REQUIRED QUOTATION TO BE SENT visited at site check and found required footage not available in the atm due required footage 3month old same inform to cm so call close *ntb* New Item :5875-0101-7490 New Serial Number :94-44683642 Old Item :5875-0101-7490 Old Serial Number :94-44683642 *ntb*"
7907108415,"• Strictly follow the steps mentioned in the tech bulletin released by TSS. (attached herewith).• Engineer should follow the steps to check the card reader using the dongle.• Before leaving from the site engineer has to capture EJ snap of successful Chip based transaction, on PM App at the time of new rollout/upgrade/installations & during any other call should share it with FSM for validation.• (sample is there in the tech bulletin as well).• In no case, engineer leaves the sites without performing live transaction using a Chip Card.• ATR Received message screen need to be saved in M audit • EMV Txn successful screen need to be saved in M Audit• ATM ID screen need to be saved in M Audit• ATR received confirmation is must.• Do a transaction (Balance inquiry / Cash withdrawal)• Check if card is getting latched?• Put ATM to supervisor mode and go to 4-Replenishment>>38-EJ Viewer• Check the EJ for transaction which you have and looks for “Chip Not Attempted” message after Card entered• If you see Chip not attempted message then check the Card reader physically for any Pin damage.• If you see “ATR Received” message after card entered then its chip based transaction. Do couple of more transactions and confirm (No need for card reader replacement)• If chip is damaged send chgc quote , as per mail from FSC, Projects <Projects.FSC@ncr.com> Tue 3/12/2019 7:35 PM # Activity # EMV Fall back Txn - Hitachi Axis CE IS NOW IN105C10 there is replesd hard disk and loaded soft were success fully tested ok working fine live txn not done due to there is card reader and mini mislinius board is faulty there is replesd hard disk and loaded soft were success fully tested ok live txn not done due to there is card reader and mini mislinius board is faulty New Item :5362-7701-8690 New Serial Number :94-44696601 Old Item :5362-7701-8690 Old Serial Number :94-44696601"
7912103243,"call logged for JP fault BOI JP has Disable but still we are receiving JP hits from ATM to Switch, there is some issue in the EJ configuration data, same Discussed with NCR Ritesh Singh (SAM) and call logged- [Generated by Portal Login: singhaut Contact: sagar dudhane 02233865337 FISPSSSLM@fisglobal.com] CE IS NOW IN105C15 As per CE ATM Operational , CE will attend this call at 11.00hrs on 3rd may. Remark visited the site ej copy n drive and ej setting properly and take the download and atm tested working fine Remark visited the site ej copy n drive and ej setting properly and take the download and atm tested working fine New Item :6642-2000-8600 New Serial Number :94-45191622 Old Item :6642-2000-8600 Old Serial Number :94-45191622"
7912304989,Caller name Dhamendra From Branch number 7505341718_Custodian number:-Dhamendra From Branch number 7505341718_ATM ID:-14576168 S/W ISSUE CE IS NOW IN105C15 branch is close so same call will attend by Tommy branch is close so same call will attend by Tommy New Item :2012-2000-8600 New Serial Number :94-48502647 Old Item :2012-2000-8600 Old Serial Number :94-48502647
7912102932,Incident ID - 000000093372837 GWU-SLM Call logged with NCR RA=LogField:NCGD125Z8B | 27Text:01/05/2019 15:29 KB AJEET KUMAR PATEL//7376159939 call log for monitor blank issue as discussed with Engg Rahul// 8299494233 | | CE IS NOW IN105C13 due to out location reconfigure the software testd ok ATM working fine. reconfigure the software testd ok ATM working fine. New Item :2012-2000-8600 New Serial Number :94-48722802 Old Item :2012-2000-8600 Old Serial Number :94-48722802
